{
  "$schema": "https://json-schema.org/draft/2020-12/schema",
  "$id": "portfolio/facts.schema.json",
  "title": "Profile facts",
  "description": "Verified facts only. Uncertain values remain null; private facts must not be added.",
  "type": "object",
  "additionalProperties": false,
  "required": [
    "schemaVersion",
    "displayName",
    "headline",
    "location",
    "languages",
    "experience",
    "education",
    "skills",
    "hobbies",
    "mediaReferences"
  ],
  "properties": {
    "schemaVersion": {
      "const": 1
    },
    "displayName": {
      "type": [
        "string",
        "null"
      ],
      "minLength": 1
    },
    "headline": {
      "type": [
        "string",
        "null"
      ],
      "minLength": 1
    },
    "location": {
      "type": [
        "string",
        "null"
      ],
      "minLength": 1
    },
    "languages": {
      "type": "array",
      "items": {
        "type": "string",
        "minLength": 1
      }
    },
    "links": {
      "description": "Public profiles elsewhere. Optional: a deployment with none simply renders none.",
      "type": "object",
      "additionalProperties": false,
      "properties": {
        "linkedin": {
          "description": "The handle in linkedin.com/in/<handle>, never the URL. A URL here would be an absolute URL and a domain in profile content, which is exactly what validate-profile.ts refuses; the address is built in site/src/sections.ts, where linkedin.com is a third-party service the code calls rather than a deployment value. The character class is what makes it safe to paste into an href.",
          "type": "string",
          "pattern": "^[A-Za-z0-9-]{1,100}$"
        }
      }
    },
    "experience": {
      "type": "array",
      "items": {
        "type": "object",
        "additionalProperties": false,
        "required": [
          "title",
          "organization",
          "start",
          "end",
          "summary"
        ],
        "properties": {
          "title": {
            "type": "string",
            "minLength": 1
          },
          "organization": {
            "type": [
              "string",
              "null"
            ]
          },
          "start": {
            "type": [
              "string",
              "null"
            ],
            "pattern": "^[0-9]{4}(-[0-9]{2})?$"
          },
          "end": {
            "type": [
              "string",
              "null"
            ],
            "pattern": "^([0-9]{4}(-[0-9]{2})?|present)$"
          },
          "summary": {
            "type": [
              "string",
              "null"
            ]
          },
          "highlights": {
            "type": "array",
            "items": {
              "type": "string",
              "minLength": 1
            }
          }
        }
      }
    },
    "education": {
      "type": "array",
      "items": {
        "type": "object",
        "additionalProperties": false,
        "required": [
          "institution",
          "degree",
          "year"
        ],
        "properties": {
          "institution": {
            "type": "string",
            "minLength": 1
          },
          "degree": {
            "type": [
              "string",
              "null"
            ]
          },
          "year": {
            "type": [
              "string",
              "null"
            ],
            "pattern": "^[0-9]{4}$"
          }
        }
      }
    },
    "skills": {
      "type": "array",
      "items": {
        "type": "string",
        "minLength": 1
      }
    },
    "hobbies": {
      "type": "array",
      "items": {
        "type": "object",
        "additionalProperties": false,
        "required": [
          "id",
          "title",
          "description",
          "mediaRef"
        ],
        "properties": {
          "id": {
            "type": "string",
            "pattern": "^[a-z0-9-]+$"
          },
          "title": {
            "type": "string",
            "minLength": 1
          },
          "headline": {
            "description": "Display line the hobbies section sets above the description, in the author's own words -- \"At the barre\" over Ballet. Optional: without one the section sets the title as the heading instead.",
            "type": [
              "string",
              "null"
            ]
          },
          "description": {
            "type": [
              "string",
              "null"
            ]
          },
          "mediaRef": {
            "type": [
              "string",
              "null"
            ]
          },
          "relatedActivities": {
            "type": "array",
            "items": {
              "type": "string",
              "minLength": 1
            }
          }
        }
      }
    },
    "mediaReferences": {
      "type": "array",
      "items": {
        "type": "object",
        "additionalProperties": false,
        "required": [
          "id",
          "role",
          "file",
          "alt"
        ],
        "properties": {
          "id": {
            "type": "string",
            "pattern": "^[a-z0-9-]+$"
          },
          "role": {
            "enum": [
              "hero",
              "hobby",
              "other"
            ]
          },
          "file": {
            "type": [
              "string",
              "null"
            ],
            "description": "Relative reference within private inputs or processed media; never an absolute URL."
          },
          "alt": {
            "type": [
              "string",
              "null"
            ]
          }
        }
      }
    }
  }
}
